{
  "auditedCommit": "cc39cb17c3ed76163ad1411b3d19af78a80ec860",
  "checkId": "static-assessment-controller",
  "command": "npm test --workspace @searise/web -- --run src/application/assessment-controller.test.ts src/application/use-assessment-runtime.test.tsx",
  "result": "passed",
  "schemaVersion": "1.0.0"
}
