{
  "auditedCommit": "c151d76c59736d41dbe29f64bb2da1520f80a861",
  "checkId": "pipeline-ar6-release-builder",
  "command": "python -m pytest src/pipeline/tests/release/test_builder.py src/pipeline/tests/release/test_evidence.py src/pipeline/tests/release/test_reproducibility.py -q",
  "result": "passed",
  "schemaVersion": "1.0.0"
}
