{
  "auditedCommit": "cc39cb17c3ed76163ad1411b3d19af78a80ec860",
  "checkId": "static-generic-host-lighthouse",
  "command": "npm run web:build && npm ci --prefix tools/static-quality && node tools/static-quality/validate-generic-static-host.mjs && node tools/static-quality/run-lighthouse-gate.mjs",
  "result": "passed",
  "schemaVersion": "1.0.0"
}
