{
  "auditedCommit": "c151d76c59736d41dbe29f64bb2da1520f80a861",
  "checkId": "static-target-content",
  "command": "node src/web/scripts/check-target-content.mjs && node src/web/scripts/static-repository-gates.mjs --target && node src/web/scripts/static-repository-gates.mjs --repository-readiness",
  "result": "passed",
  "schemaVersion": "1.0.0"
}
