{
  "auditedCommit": "c151d76c59736d41dbe29f64bb2da1520f80a861",
  "checkId": "static-settlement-search",
  "command": "npm run test:search-shard-builder --workspace @searise/web && npm run test:search-performance-evidence --workspace @searise/web",
  "result": "passed",
  "schemaVersion": "1.0.0"
}
