{
  "auditedCommit": "cc39cb17c3ed76163ad1411b3d19af78a80ec860",
  "checkId": "pipeline-reviewed-cog-range-access",
  "command": "python -m pytest src/pipeline/tests/offline_release/test_cog_range.py src/pipeline/tests/offline_release/test_cog_range_evidence.py -q",
  "result": "passed",
  "schemaVersion": "1.0.0"
}
